Country,Embassy Name,Embassy Address,Google Maps URL
Afghanistan,"Embassy of France, Monaco","Roc Fleuri, 1 rue du Ténao Le Roc fleuri, 1 Rue de Tenao, 98000 Monaco",https://www.google.com/maps/place/?q=place_id:ChIJCZK83XnCzRIR_Je8pl9jzAs
Afghanistan,Ambassade de France,"Jadayi Sulh, Kabul, Afghanistan",https://www.google.com/maps/place/?q=place_id:ChIJnR2OwbFu0TgROX8aXrGg3jo
Angola,Embassy of France,"R. Rev. Agostinho Pedro Neto 31-33, Luanda, Angola",https://www.google.com/maps/place/?q=place_id:ChIJL9uzFUzyURoR4RMd2JBFHpU
Albania,Embassy of France,"Rruga Skënderbej 14 Tirana AL, 1000, Albania",https://www.google.com/maps/place/?q=place_id:ChIJq7KjFAgxUBMRMK-ep9UsCPA
Andorra,Ambassade de France,"Carrer les Canals, 38, AD500 Andorra la Vella, Andorra",https://www.google.com/maps/place/?q=place_id:ChIJV7DeOtKKpRIRq4K5oG7q0OE
United Arab Emirates,Embassy of France,Etihad Towers Office Tower n°3 Office Tower n°3 - Corniche W St - Abu Dhabi - United Arab Emirates,https://www.google.com/maps/place/?q=place_id:ChIJI2sdOaBoXj4R-8YPC5uvrXk
United Arab Emirates,Consulat Général de France / Consulate General of France / القنصلية العامة الفرنسية,Habtoor Business Tower - 32e étage - Dubai - United Arab Emirates,https://www.google.com/maps/place/?q=place_id:ChIJzYH3x1NrXz4RlvKGU3esxMA
Argentina,"Embassy of France, Buenos Aires","Cerrito 1399, C1010 CABA, Argentina",https://www.google.com/maps/place/?q=place_id:ChIJq8OksYwto5URmuHgp6HXCnM
Argentina,Consulate General of France,"Basavilbaso 1253, C1006AAA CABA, Argentina",https://www.google.com/maps/place/?q=place_id:ChIJBWvaQLbKvJURq2ts4cvmGaQ
Armenia,Embassy of France,"8 rue Saint Grigor Loussavoritch, Yerevan 0015, Armenia",https://www.google.com/maps/place/?q=place_id:ChIJ5Wd9vle8akARk2fp1B1VhRg
Australia,Embassy of France,"6 Perth avenue Yarralumla, Canberra ACT 2600, Australia",https://www.google.com/maps/place/?q=place_id:ChIJHTwmiidNFmsRSIRZ8XuQND0
Australia,Consulat Général de France / Consulate General of France,"Level 26, St Martins Tower, 31 Market St, Sydney NSW 2000, Australia",https://www.google.com/maps/place/?q=place_id:ChIJ87aQ3T6uEmsRybazVluy5fI
Australia,Consulate Of France,"4/105 Broadway, Nedlands WA 6009, Australia",https://www.google.com/maps/place/?q=place_id:ChIJbaOdU_qkMioRRgP1hGyG1KQ
Australia,L’Agence Consulaire de France d’Adélaïde,"49 Oxford Terrace, Unley SA 5061, Australia",https://www.google.com/maps/place/?q=place_id:ChIJvb7_0cfOsGoRXpibzViMf-g
Australia,Honorary Consulate General of France,"342A St Kilda Rd, Melbourne VIC 3004, Australia",https://www.google.com/maps/place/?q=place_id:ChIJ792u7qhC1moRy8wLpJHLhpg
Austria,"Embassy of France, Vienna","Technikerstraße 2, 1040 Wien, Austria",https://www.google.com/maps/place/?q=place_id:ChIJX2VrFXgHbUcRwEtlG-N_saY
Burundi,Embassy of France,"60 Bd de l'Uprona, Bujumbura, Burundi",https://www.google.com/maps/place/?q=place_id:ChIJI4rMnx2DwRkRPajJeRAn8c8
Belgium,Ambassade de France,"Rue Ducale 65, 1000 Bruxelles, Belgium",https://www.google.com/maps/place/?q=place_id:ChIJIdYMmoPEw0cR3rH7ADyKMqE
Belgium,Consulat Général de Carrière France Antwerpen,"Belgiëlei 134, 2018 Antwerpen, Belgium",https://www.google.com/maps/place/?q=place_id:ChIJHbJ6aNv2w0cRRikebgZ22Gw
Benin,Embassy of France,"2235 Ave Jean-Paul II, Cotonou, Benin",https://www.google.com/maps/place/?q=place_id:ChIJL81fC1FUIxARUL5hKp-xu6Q
Benin,Résidence de France,"9C27+GF9, Boulevard de la Marina, Cotonou, Benin",https://www.google.com/maps/place/?q=place_id:ChIJzZ7adlpVIxAR9N3zQzw-RBE
"Bonaire, Sint Eustatius and Saba",Ambassade de France / Embassy of France,"Nelson Mandela Drive Vigie Castries, St. Lucia",https://www.google.com/maps/place/?q=place_id:ChIJ6RklV8JnQIwRTfzeOjHG_z8
Burkina Faso,Embassy of France,"01 Rue de l'Hospitalité, Quartier Koulouba Entrée visiteurs - face à la RTB-Télévision, Ouagadougou, Ouagadougou, Burkina Faso",https://www.google.com/maps/place/?q=place_id:ChIJuyCZTDu-Lg4R486eNOcKFxU
Bangladesh,Embassy of France,"Diplomatic Enclave, Madani Ave, Dhaka 1212, Bangladesh",https://www.google.com/maps/place/?q=place_id:ChIJ41bgsbrHVTcRqgUUxoMkgeA
Bulgaria,Embassy of the Republic of France,"27, rue Oborichté 29, 1504 Sofia, Bulgaria",https://www.google.com/maps/place/?q=place_id:ChIJYwzAep2FqkARq4Mowhxnw0g
Bahrain,Embassy of France,"Villa 51 A, Rd No 1901, Manama, Bahrain",https://www.google.com/maps/place/?q=place_id:ChIJL0_631SvST4RJwqc2D697lQ
Bahrain,France Visa Application Center,"Road 1722, 1565, 18th Floor, Diplomatic Commercial Offices Tower, Manama, Bahrain",https://www.google.com/maps/place/?q=place_id:ChIJZ9huPJ-lST4RzDxrW6pgPOA
Saint Barthélemy,Ambassade de France / Embassy of France,"Nelson Mandela Drive Vigie Castries, St. Lucia",https://www.google.com/maps/place/?q=place_id:ChIJ6RklV8JnQIwRTfzeOjHG_z8
Belarus,Embassy of France,"la Liberté, 11, place de, Minsk 220030, Belarus",https://www.google.com/maps/place/?q=place_id:ChIJ9cDWVOrP20YRgvKGnnS0O80
"Bolivia, Plurinational State of",ambassador of France to Bolivia,"Obrajes, Calle 8 N° 5390 entre Siles y Ormachea, La Paz, Bolivia",https://www.google.com/maps/place/?q=place_id:ChIJ2fA6Qe8gX5ERzJd0XHaBQxc
Brunei Darussalam,Embassy of France,"Yayasan Sultan Haji Hassanal Bolkiah Complex Unit 2.01, Block A, 2ème étage, Jln Pretty, Bandar Seri Begawan BS8711, Brunei",https://www.google.com/maps/place/?q=place_id:ChIJ4-4yntGKIjIRghggiMkIiHk
Bouvet Island,Ambassade de France / Embassy of France,"Immeuble La Ciotat à Mont Fleuri 1er étage Victoria Mahé, Seychelles",https://www.google.com/maps/place/?q=place_id:ChIJYW6avhkp4CIRY2HZyteh-P8
Botswana,Embassy of France,"761 Robinson Rd, Gaborone, Botswana",https://www.google.com/maps/place/?q=place_id:ChIJcxkrf6Nbux4REwdDOs3-jro
Central African Republic,Embassy of France,"Avenue Charles-de-Gaulle, Central African Republic",https://www.google.com/maps/place/?q=place_id:ChIJW2A8JrXvuBARLSoOsOHbRyg
Switzerland,Ambassade de France / Französische Botschaft,"Schosshaldenstrasse 46, 3006 Bern, Switzerland",https://www.google.com/maps/place/?q=place_id:ChIJgWQr8mE3jkcRo45r2CzEojg
Switzerland,Consulate of France,"Signaustrasse 1, 8008 Zürich, Switzerland",https://www.google.com/maps/place/?q=place_id:ChIJ4agjYEynmkcRpSIxGZIshqY
Switzerland,Consulate General of France,"Cours des Bastions 2, 1205 Genève, Switzerland",https://www.google.com/maps/place/?q=place_id:ChIJE66dxixljEcRADvUQLYR2Vg
Switzerland,Permanent Mission of France,"Rte de Pregny 36, 1292 Pregny-Chambésy, Switzerland",https://www.google.com/maps/place/?q=place_id:ChIJz_p111VkjEcRkwclpuzjIZg
Chile,"Embassy of France, Santiago","Condell 65, 7500753 Providencia, Región Metropolitana, Chile",https://www.google.com/maps/place/?q=place_id:ChIJg7XqDYTFYpYRBFdyaMKEhPs
China,Consulate General of the Republic of France in Shanghai,"China, Shanghai, Changning District, Zhongshan W Rd, 1055号SOHO中山广场A座18层 邮政编码: 200051",https://www.google.com/maps/place/?q=place_id:ChIJF95y7xBlsjURRfuo9V67Lv8
China,Consulate General of the Republic of France in Guangzhou,"China, Guangdong Province, Guangzhou, Yuexiu District, Huanshi E Rd, 339号广东国际大厦主楼写字楼810室 邮政编码: 510098",https://www.google.com/maps/place/?q=place_id:ChIJbzx6StT4AjQR1Z2DyWZXHl8
China,Consulate General of the Republic of France in Shenyang,"34 S Shisanwei Rd, Heping District, Shenyang, Shenyang, Liaoning, China, 110003",https://www.google.com/maps/place/?q=place_id:ChIJ2dUcGJaHL14RCbKcjVfhKhs
China,"Consulate General of France, Chengdu","2 Zongfu Rd, 盐市口商圈 Jinjiang District, Chengdu, Sichuan, China, 610016",https://www.google.com/maps/place/?q=place_id:ChIJ6WZLLUHF7zYRceR6yaLivNI
China,Consulate General of France in Wuhan,"China, Hubei, Wuhan, Jianghan District, Jianshe Blvd, 568号新世界国贸大厦1702 邮政编码: 430022",https://www.google.com/maps/place/?q=place_id:ChIJy4LUFcKuLjQRuBKjOBl_DfI
China,Consulate General of the Republic of France in Shanghai,"China, Shanghai, Huangpu, Guangdong Rd, 689号海通证券大厦201 邮政编码: 200003",https://www.google.com/maps/place/?q=place_id:ChIJ_bHCHWhwsjURWkdRpBYugHI
China,Official Residence of Consulate General of the Republic of France in Shanghai,"1431 Huaihai Rd (M), Xuhui District, Shanghai, China, 200031",https://www.google.com/maps/place/?q=place_id:ChIJxx-jbK16sjURKWXR7iCRgI8
China,Embassy of France in the Republic of China Former Site （North Gate）,"19 Beijing W Rd, Gulou, Nanjing, Jiangsu, China, 210024",https://www.google.com/maps/place/?q=place_id:ChIJzRwsrKGMtTURGxYhH8Wv608
China,France Zhu China Minguo Embassy Former Site （West Gate）,"56 Gao Yun Ling, Gulou, Nanjing, Jiangsu, China, 210009",https://www.google.com/maps/place/?q=place_id:ChIJw7dXFrGMtTUR17f-UBPRRPs
Côte d'Ivoire,Ambassade de France En Côte d'Ivoire,"82H5+96F, Abidjan, Côte d’Ivoire",https://www.google.com/maps/place/?q=place_id:ChIJk-wyOMrrwQ8R3lL62gROmmI
Côte d'Ivoire,Consulat général de France,"8XGM+78G, Abidjan, Côte d’Ivoire",https://www.google.com/maps/place/?q=place_id:ChIJbT28WbrrwQ8R2SdibXepetw
Cameroon,Embassy of France,"Plateau, Atemengue, Yaoundé, Cameroon",https://www.google.com/maps/place/?q=place_id:ChIJE42Ti5LPixARvFOJKUAZsFI
"Congo, The Democratic Republic of the",Embassy of France,"Avenue du, Ave Colonel Mondjiba, Kinshasa, Congo - Kinshasa",https://www.google.com/maps/place/?q=place_id:ChIJk94tatYzahoRwq8SiKHDv-4
Congo,Embassy of France,"Avenue du, Ave Colonel Mondjiba, Kinshasa, Congo - Kinshasa",https://www.google.com/maps/place/?q=place_id:ChIJk94tatYzahoRwq8SiKHDv-4
Congo,Embassy of France,"Ave Alfassa, Brazzaville, Congo - Brazzaville",https://www.google.com/maps/place/?q=place_id:ChIJ-Qh_Xw4zahoRiOhbsiIIBaw
Colombia,"Embassy of France, Bogotá","Cra. 11 #93-12, Bogotá, Colombia",https://www.google.com/maps/place/?q=place_id:ChIJpXFsdo6aP44Ri70NQfQhaE4
Colombia,Consulate of France in Cali,"Av. 3 Nte. #n° 8N-24, Granada, Cali, Valle del Cauca, Colombia",https://www.google.com/maps/place/?q=place_id:ChIJ4SB382-mMI4RAL3dQa7tFxo
Comoros,Embassy of France,"Boulevard de Strasbourg, Moroni, Comoros",https://www.google.com/maps/place/?q=place_id:ChIJA4AIOlH5mBgRoL9wR2GKNZk
Cabo Verde,Ambassade de France / Embaixada da França,"Quartier du Plateau 28 Tenente Valadim Praia Santiago, 0192, Cape Verde",https://www.google.com/maps/place/?q=place_id:ChIJuYq0zUeZNQkRBXen1PbCRl0
Costa Rica,Embassy of France,"De la Mitsubishi - 200m sur y 25m oeste, San José Province, Curridabat, 1000, Costa Rica",https://www.google.com/maps/place/?q=place_id:ChIJ0eldDZPjoI8RidIHDMHCLCg
Cuba,Embassy of France,"312 Calle 14, La Habana, Cuba",https://www.google.com/maps/place/?q=place_id:ChIJT6VdwTx3zYgR4JPESAI9mLo
Cayman Islands,Ambassade de France / Embassy of France,"4101 Reservoir Rd NW, Washington, DC 20007, United States",https://www.google.com/maps/place/?q=place_id:ChIJc8U1As63t4kRBfl0dgCjKeI
Cyprus,Ambassade de France,"34 Demostheni Severi av, 2ème Étage, Nicosia 1080, Cyprus",https://www.google.com/maps/place/?q=place_id:ChIJd5dBE_kZ3hQR5wY98GGJCto
Cyprus,Consul honraire de France,"RCWW+JGR, Tala 8577, Cyprus",https://www.google.com/maps/place/?q=place_id:ChIJB8Jm6ZQJ5xQRcowV2ArAfMs
Czechia,"Embassy of France, Prague","Velkopřevorské nám. 2, 118 01 Malá Strana, Czechia",https://www.google.com/maps/place/?q=place_id:ChIJnU2zm-OUC0cRAWac32oXtpc
Germany,Embassy of France,"Pariser Platz 5, 10117 Berlin, Germany",https://www.google.com/maps/place/?q=place_id:ChIJfQBe6cZRqEcRzO3nNhy8UUo
Germany,Consulat Général de France,"Heimeranstraße 31, 80339 München, Germany",https://www.google.com/maps/place/?q=place_id:ChIJn4F-navYnUcRdMQs4ldYGHU
Djibouti,Embassy of France,"Boulevard Idriss Omar Guelleh, Djibouti",https://www.google.com/maps/place/?q=place_id:ChIJ_36dz-wAIxYRj_E_xYjVDB4
Dominica,Ambassade de France / Embassy of France,"Nelson Mandela Drive Vigie Castries, St. Lucia",https://www.google.com/maps/place/?q=place_id:ChIJ6RklV8JnQIwRTfzeOjHG_z8
Dominica,Embassy of France,"Edificio Corporativo 2015, C. Filomena Gomez de Cova, Santo Domingo, Dominican Republic",https://www.google.com/maps/place/?q=place_id:ChIJSz_RGhaIr44REnr60Zdua7w
Denmark,Consulate of France,"Ny Østergade 3, 1101 København, Denmark",https://www.google.com/maps/place/?q=place_id:ChIJwwizexdTUkYR1rYz9ElcgfQ
Dominican Republic,Embassy of France,"Edificio Corporativo 2015, C. Filomena Gomez de Cova, Santo Domingo, Dominican Republic",https://www.google.com/maps/place/?q=place_id:ChIJSz_RGhaIr44REnr60Zdua7w
Algeria,Embassy of France in Algiers,"25 Chem. Abdelkader Gadouche, Hydra 16035, Algeria",https://www.google.com/maps/place/?q=place_id:ChIJn-oq8wyyjxIRO7nYIvebsus
Algeria,Résidence de l'ambassade de France,"Q2CQ+9RM, N41, El Biar 16000, Algeria",https://www.google.com/maps/place/?q=place_id:ChIJQ-w9JUeyjxIRfR4TgvpXE_Q
Egypt,Embassy of France,"29 Charles de Gaulle, Oula, Giza District, Giza Governorate 3726513, Egypt",https://www.google.com/maps/place/?q=place_id:ChIJobBhqNhGWBQR3tYrNhehf5M
Egypt,General France Consulate,"7 rue Abu Shamar, Oula, Giza District, Giza Governorate 3726512, Egypt",https://www.google.com/maps/place/?q=place_id:ChIJZf8kSORGWBQR6IeG4i8XHQU
Eritrea,Embassy of France,"Warsay street, Saba Building, 8ème étage, Asmara, Eritrea",https://www.google.com/maps/place/?q=place_id:ChIJCfOtnFLybRYRE_-jlwKuUe0
Western Sahara,Consulat Général de France / القنصلية العامة لفرنسا,"Rue Camille Cabana, Marrakesh 40001, Morocco",https://www.google.com/maps/place/?q=place_id:ChIJx3OI3uzurw0RrcQoY2hwNd8
Western Sahara,Ambassade de France / سفارة فرنسا,"1 Rue Ibn Hajar, Rabat, Morocco",https://www.google.com/maps/place/?q=place_id:ChIJ9SmKBIhspw0RRbF9iQVerpI
Western Sahara,Consulate General of France,"1 Rue Aguelmane Sidi Ali, Rabat 10000, Morocco",https://www.google.com/maps/place/?q=place_id:ChIJiWK2K3tspw0RE_UEti8s89M
Spain,Embassy of France,"C. de Salustiano Olózaga, 9, 28001 Madrid, Spain",https://www.google.com/maps/place/?q=place_id:ChIJP683qZsoQg0RrOG-F8lOl94
Spain,Consulate General of France,"Ronda de la Univ., 22b, Piso 4, 08007 Barcelona, Spain",https://www.google.com/maps/place/?q=place_id:ChIJR_dElvOipBIRPqZWInAwz7g
Estonia,Embassy of France,"Toom-Kuninga 20, 15185 Tallinn, Estonia",https://www.google.com/maps/place/?q=place_id:ChIJKconHJqUkkYRVHAvCmLDa2Q
Ethiopia,Embassy of France,"3Q2C+G67, Angola St, Addis Ababa, Ethiopia",https://www.google.com/maps/place/?q=place_id:ChIJUw-Y8XKPSxYRF_9UK0ku_L8
Finland,Embassy of France in Helsinki,"Itäinen Puistotie 13, 00140 Helsinki, Finland",https://www.google.com/maps/place/?q=place_id:ChIJLY9Ubr8LkkYRBR8dlwIqTcI
Fiji,Embassy Of France,"Pacific House, 2nd Floor, Butt St, Suva, Fiji",https://www.google.com/maps/place/?q=place_id:ChIJsZlFwCDcG24RJDIQ2-iK_B4
France,Consulate General of France,"Cours des Bastions 2, 1205 Genève, Switzerland",https://www.google.com/maps/place/?q=place_id:ChIJE66dxixljEcRADvUQLYR2Vg
Gabon,Consulate General of France,"BP2161, Rue Ange M'ba, Libreville, Gabon",https://www.google.com/maps/place/?q=place_id:ChIJ53r2Wo07fxARliO3NWoD-tY
United Kingdom,"Embassy of France, London","58 Knightsbridge, London SW1X 7JT, United Kingdom",https://www.google.com/maps/place/?q=place_id:ChIJOeVHReIFdkgRTDavr-S5joM
United Kingdom,Embassy of France,"11 Kensington Palace Gardens, London W8 4QP, United Kingdom",https://www.google.com/maps/place/?q=place_id:ChIJaeOH4vgPdkgRtPDSKFbzJlE
Georgia,"Embassy of France, Tbilisi","49, rue, Krtsanisi St, Tbilisi 0114, Georgia",https://www.google.com/maps/place/?q=place_id:ChIJXYigFG4MREARpgHuJvNSlus
Ghana,Embassy of France,"Fourth Circular Rd, Accra, Ghana",https://www.google.com/maps/place/?q=place_id:ChIJ_____y-m-b0RhwSevaiYmPg
Guinea,Embassy of France,"G76P+843, Avenue du Commerce (Kaloum, Blvd de Commerce, Conakry, Guinea",https://www.google.com/maps/place/?q=place_id:ChIJCzhFO5fQHA8R5TKCD9gbqOU
Gambia,Agence Consulaire De France Gambia,"TAF ESTATES, Brufut, Gambia",https://www.google.com/maps/place/?q=place_id:ChIJwZ3A3gmXwg4RXW1Z-ODxaZ0
Guinea-Bissau,Embassy of France,"Bissau, Guinea-Bissau",https://www.google.com/maps/place/?q=place_id:ChIJ_fa6Vxzb5g4RQjbaYKQ76ZM
Equatorial Guinea,Embassy of France,"Carr. del Aeropuerto, Malabo, Equatorial Guinea",https://www.google.com/maps/place/?q=place_id:ChIJ0yppwuyeZhAR7dHja1hu72I
Greece,Embassy of France,"Leof. Vasilissis Sofias 7, Athina 106 71, Greece",https://www.google.com/maps/place/?q=place_id:ChIJL29RNj-9oRQRYT6vEtydtP8
Greece,Consulate of France,"6 rue, Akadimias, Athina 106 71, Greece",https://www.google.com/maps/place/?q=place_id:ChIJr9rvyTi9oRQR2Jm3JqHQMh8
French Guiana,Embassy of France,"Dr. J.F. Nassylaan 23, Paramaribo, Suriname",https://www.google.com/maps/place/?q=place_id:ChIJl4VE6crKCY0R6RKaPS_iLgk
Guam,Ambassade de France aux Philippines,"Extension et, 16th Floor Pacific Star Building angle Senator Gil Puyat, Makati Ave, Makati, 1200, Philippines",https://www.google.com/maps/place/?q=place_id:ChIJ5eeQARLJlzMRgeRwN-aA95o
Hong Kong,Consulat Général de France / Consulate General of France,"25/F & 26/F Tower II, Admiralty Centre, 18 Harcourt Rd, Central, Hong Kong",https://www.google.com/maps/place/?q=place_id:ChIJG-EZBmcABDQR0Ql_wWn8pxA
Honduras,Embassy of France,"la BID, Colonia Altos Lomas del Guijarro Sur 4ta. Avenida, 2da Calle Bloque B, Lote 7, Fte a, Tegucigalpa 11101, Honduras",https://www.google.com/maps/place/?q=place_id:ChIJyVpar9yib48Rt-IX5AALOw4
Croatia,Embassy of France,"Ul. Grada Vukovara 284b, 10000, Zagreb, Croatia",https://www.google.com/maps/place/?q=place_id:ChIJ6c0uTfnWZUcRpYoJU4zf8og
Haiti,Embassy of France,"51 Rue Capois, Port-au-Prince, Haiti",https://www.google.com/maps/place/?q=place_id:ChIJlQP9aVfduY4RZOxMezq44YY
Haiti,Ambassade de France,"16 Rue Capois, Port-au-Prince, Haiti",https://www.google.com/maps/place/?q=place_id:ChIJ8cZGtJvduY4Ry1u1t_4W_Mo
Haiti,Consulat de France,"GMQ8+J8V, Port-au-Prince, Haiti",https://www.google.com/maps/place/?q=place_id:ChIJ05eIomTduY4Rqs2fXcTtT50
Haiti,Embassy De France,"HM36+93M, Unnamed Road, Port-au-Prince, Haiti",https://www.google.com/maps/place/?q=place_id:ChIJOcxUsEvduY4R3M6ZB26nGZE
Hungary,"Embassy of France, Budapest","Budapest, Kossuth Lajos tér 13-15, 1055 Hungary",https://www.google.com/maps/place/?q=place_id:ChIJmZZB5nfcQUcRvHhDejqF6Xw
Hungary,Section consulaire de l'ambassade de France en Hongrie,"Budapest, Fő u. 17, 1011 Hungary",https://www.google.com/maps/place/?q=place_id:ChIJLa1YHtndQUcRVmmHzL9Arkk
Indonesia,Embassy of France,"Jl. M.H. Thamrin No.20, RT.9/RW.4, Gondangdia, Kec. Menteng, Kota Jakarta Pusat, Daerah Khusus Ibukota Jakarta 10350, Indonesia",https://www.google.com/maps/place/?q=place_id:ChIJY8uVfib0aS4RsC4D0rr-65o
Isle of Man,Le mariage pour tous - France in the United Kingdom - La France au Royaume-Uni,"Rhenwyllan Cl, Port St Mary, Isle of Man IM9 6LN, Isle of Man",https://www.google.com/maps/place/?q=place_id:ChIJlXAjkFXzY0gRIrNJ5pioCb4
India,Embassy of France,"2/50-E, Shantipath, Chanakyapuri, New Delhi, Delhi 110021, India",https://www.google.com/maps/place/?q=place_id:ChIJQ7D5O2cdDTkRffNpTG2EiHA
India,Consulat Général de France / Consulate General of France,"WOCKHARDT TOWERS, Wockhardt Towers East Wing, 5e étage, Bandra Kurla Complex, Bandra East, Mumbai, Maharashtra 400051, India",https://www.google.com/maps/place/?q=place_id:ChIJaZSFeefI5zsR7ZmGv79g1x0
India,Consulate General of France in Calcutta,"21C, Raja Santosh Rd, Mangalam, Alipore, Kolkata, West Bengal 700027, India",https://www.google.com/maps/place/?q=place_id:ChIJ18sqkFR3AjoRuHbxHoWxZmE
India,Consulat Général de France / Consulate General of France,"21, Palace Rd, Vasanth Nagar, Bengaluru, Karnataka 560052, India",https://www.google.com/maps/place/?q=place_id:ChIJ2yGYDUEWrjsRc3bLwFlfzgY
India,Bureau Of France In Chennai,"Bannari Amman Towers Block-A, Bannari Amman Towers, 6th Floor, Bannari Amman Towers, 29, Dr Radha Krishnan Salai, Mylapore, Chennai, Tamil Nadu 600004, India",https://www.google.com/maps/place/?q=place_id:ChIJY3CAxi5mUjoR2jUTdbt0IC4
India,Consulat Général de France / Consulate General of France,"2, Marine Street, White Town, Puducherry, 605001, India",https://www.google.com/maps/place/?q=place_id:ChIJ_5I_hdNjUzoRFFOOK636c-c
India,Campus France India Network (Kochi),"Chavara Cultural Centre 4th floor, Near South Railway Station, Cross Road, Karikkamuri Rd, Ernakulam South, Kochi, Kerala 682011, India",https://www.google.com/maps/place/?q=place_id:ChIJfQU1YrNyCDsRPc1fKQm1WPM
India,Honorary Consulate Of France,"No 33, Kasturi Rangan Rd, Parthasarathypuram, Alwarpet, Chennai, Tamil Nadu 600018, India",https://www.google.com/maps/place/?q=place_id:ChIJgVxMQzZmUjoRC6WS96rT3aI
"Iran, Islamic Republic of",Embassy of France,"Tehran Province, Tehran, District 11، خیابان نوفل لوشاتو، پلاک 64-66, Iran",https://www.google.com/maps/place/?q=place_id:ChIJS58T958Bjj8RCGEWZh1epAg
Iraq,Embassy of France,"rue 55 - n°7 Emplacement, 102 Abu Nawas, Baghdad, Iraq",https://www.google.com/maps/place/?q=place_id:ChIJHY14_pGBVxURVgc1S8PJ_PM
Iceland,Embassy of France,"Túngata, 101 Reykjavík, Iceland",https://www.google.com/maps/place/?q=place_id:ChIJqZj0MywL1kgRIwamci8Azk8
Israel,Ambassade de France / שגרירות צרפת,"112 promenade, Herbert Samuel, Tel Aviv-Yafo, Israel",https://www.google.com/maps/place/?q=place_id:ChIJwSQi8XtMHRUR1JHLybYLfnM
Israel,Consulat Général de France / הקונסוליה הכללית של צרפת,"Immeuble Migdalor, 11ème étage 1/3, Ben Yehuda St 1, Tel Aviv-Yafo, 6380101, Israel",https://www.google.com/maps/place/?q=place_id:ChIJldobLodMHRURlp90WN925Ls
Israel,Consulat Général de France / القنصلية العامة لفرنسا / הקונסוליה הכללית של צרפת,"5, rue, Paul Emile Botta St, Jerusalem, Israel",https://www.google.com/maps/place/?q=place_id:ChIJM209X9IpAxUR6xGkz83GQkc
Italy,Embassy of France in Italy,"Palazzo Farnese, Piazza Farnese, 67, 00186 Roma RM, Italy",https://www.google.com/maps/place/?q=place_id:ChIJr_HOwkVgLxMRr-Nb0manKWg
Italy,Consulat de France / Consolato di Francia,"Via Giulia, 252, 00186 Roma RM, Italy",https://www.google.com/maps/place/?q=place_id:ChIJMRAU3kVgLxMRIg2_MJ8FvxM
Italy,Consulate of France,"Calle Seconda de la Fava, 6140, 30122 Venezia VE, Italy",https://www.google.com/maps/place/?q=place_id:ChIJ33Kx5tixfkcR56mYONIF6m0
Italy,General Consulate of France,"Via Privata Cesare Mangili, 1, 20121 Milano MI, Italy",https://www.google.com/maps/place/?q=place_id:ChIJbyhwD7bGhkcRF_58HkCL-ik
Jamaica,Embassy of France,"13 Hillcrest Ave, Kingston, Jamaica",https://www.google.com/maps/place/?q=place_id:ChIJ36lD0f8-244R-AJ_gfJju1Q
Jersey,Agence Consulaire De France,"Halkett Pl, St Helier, Jersey JE2 4WG, Jersey",https://www.google.com/maps/place/?q=place_id:ChIJaQtu26BSDEgRUTJukUOyMEo
Jordan,Embassy of France,"40, rue, Al-Mutanabbi St., Amman, Jordan",https://www.google.com/maps/place/?q=place_id:ChIJaW0E1WKgHBUR90DgsdwoR1s
Japan,Embassy of France,"4 Chome-11-44 Minamiazabu, Minato City, Tokyo 106-8514, Japan",https://www.google.com/maps/place/?q=place_id:ChIJpWBMGQyLGGARE120R3fqSIE
Kazakhstan,Embassy of France,"62, rue Kosmonavtov 4e étage, Astana 010000, Kazakhstan",https://www.google.com/maps/place/?q=place_id:ChIJv9Fxy7mGRUIRuRhDmZRMsbY
Kenya,Ambassade de France à Nairobi,"Peponi Gardens, Nairobi, Kenya",https://www.google.com/maps/place/?q=place_id:ChIJu4XzbNEQLxgRyzydik3QpD0
Cambodia,Ambassade de France,"Phnom, 1 Preah Monivong Blvd (93), Penh 12201, Cambodia",https://www.google.com/maps/place/?q=place_id:ChIJOwhLp2BRCTERKJH-dL8V8lw
Kiribati,Ambassade de France,"34 Demostheni Severi av, 2ème Étage, Nicosia 1080, Cyprus",https://www.google.com/maps/place/?q=place_id:ChIJd5dBE_kZ3hQR5wY98GGJCto
Saint Kitts and Nevis,Ambassade de France / Embassy of France,"Nelson Mandela Drive Vigie Castries, St. Lucia",https://www.google.com/maps/place/?q=place_id:ChIJ6RklV8JnQIwRTfzeOjHG_z8
"Korea, Republic of",Embassy of France / Ambassade de France,"43-12 Seosomun-ro, Seodaemun-gu, Seoul, South Korea",https://www.google.com/maps/place/?q=place_id:ChIJR9yFrGKifDURg_6VXaRJ_Bg
Kuwait,Embassy of France,"Kuwait City, Kuwait",https://www.google.com/maps/place/?q=place_id:ChIJdckgc62Ezz8RHc_Lxov2q48
Kuwait,Embassy of France,"23-29 13 St, Kuwait",https://www.google.com/maps/place/?q=place_id:ChIJjcxoEq2Ezz8RYzmra5zZmJo
Lao People's Democratic Republic,Embassy of France,"Rue Setthathirath, Vientiane, Laos",https://www.google.com/maps/place/?q=place_id:ChIJZyv49YZoJDERtikkXPw2tC0
Lebanon,Embassy of France,"Espace des Lettres, Beirut, Lebanon",https://www.google.com/maps/place/?q=place_id:ChIJd72J48EXHxURDQofX0rm5NI
Liberia,France Embassy,"76R8+RGJ, 11th Street, Monrovia, Liberia",https://www.google.com/maps/place/?q=place_id:ChIJicBJXdpTQRARjM6r-3IY2oA
Liberia,Embassy of France,"77G3+9F6, Monrovia, Liberia",https://www.google.com/maps/place/?q=place_id:ChIJ8Y-WgmcCCg8RwbJ4YrblX_I
Liberia,Ambassade de France / Embassy of France,"Mamba Point, 98A, United Nations Dr, Monrovia, Liberia",https://www.google.com/maps/place/?q=place_id:ChIJJcnUi4D3CQ8RXj9sehJvJ7c
Libya,Embassy of France,"V5JV+W7W, Tripoli, Libya",https://www.google.com/maps/place/?q=place_id:ChIJI_fZO8OSqBMROVnEB8PKAh4
Saint Lucia,Ambassade de France / Embassy of France,"Nelson Mandela Drive Vigie Castries, St. Lucia",https://www.google.com/maps/place/?q=place_id:ChIJ6RklV8JnQIwRTfzeOjHG_z8
Liechtenstein,Ambassade de France / Französische Botschaft,"Schosshaldenstrasse 46, 3006 Bern, Switzerland",https://www.google.com/maps/place/?q=place_id:ChIJgWQr8mE3jkcRo45r2CzEojg
